<?xml version="1.0" encoding="UTF-8"?>
<xs:schema xmlns:xs="http://www.w3.org/2001/XMLSchema" elementFormDefault="qualified"
    targetNamespace="http://www.projekat.org/zalbazbogcutanja"
    xmlns:zc="http://www.projekat.org/zalbazbogcutanja">
    <xs:element name="zalba_cutanje">
        <xs:complexType>
            <xs:sequence>
                <xs:element name="naslov">
                    <xs:simpleType>
                        <xs:restriction base="xs:string">
                            <xs:minLength value="1"/>
                        </xs:restriction>
                    </xs:simpleType>
                </xs:element>
                <xs:element name="podaci_o_povereniku" type="zc:TPravno_lice"/>
                <xs:element name="telo_zalbe" type="zc:Ttelo_zalbe"/>
                <xs:element name="podaci_o_podnosiocu_zalbe" type="zc:TFizicko_lice"/>
                <xs:element name="podaci_o_mestu_i_datumu_podnosenja_zalbe" type="zc:Tmesto_datum"/>
            </xs:sequence>
            <xs:attribute name="id" use="required">
                <xs:simpleType>
                    <xs:restriction base="xs:int">
                        <xs:minInclusive value="0"/>
                    </xs:restriction>
                </xs:simpleType>
            </xs:attribute>
            <xs:attribute name="username" use="required">
                <xs:simpleType>
                    <xs:restriction base="xs:string">
                        <xs:minLength value="1"/>
                    </xs:restriction>
                </xs:simpleType>
            </xs:attribute>
            <xs:attribute name="nazivOrgana" use="required">
                <xs:simpleType>
                    <xs:restriction base="xs:string">
                        <xs:minLength value="1"/>
                    </xs:restriction>
                </xs:simpleType>
            </xs:attribute>
        </xs:complexType>
    </xs:element>
    <xs:element name="adresa">
        <xs:complexType>
            <xs:sequence>
                <xs:element name="grad">
                    <xs:simpleType>
                        <xs:restriction base="xs:string">
                            <xs:minLength value="1"/>
                            <xs:maxLength value="50"/>
                        </xs:restriction>
                    </xs:simpleType>
                </xs:element>
                <xs:element name="ulica">
                    <xs:simpleType>
                        <xs:restriction base="xs:string">
                            <xs:minLength value="1"/>
                            <xs:maxLength value="50"/>
                        </xs:restriction>
                    </xs:simpleType>
                </xs:element>
                <xs:element name="broj" type="xs:positiveInteger"/>
            </xs:sequence>
        </xs:complexType>
    </xs:element>
    <xs:complexType abstract="true" name="TLice">
        <xs:sequence>
            <xs:element ref="zc:adresa"/>
        </xs:sequence>
    </xs:complexType>
    <xs:complexType name="TPravno_lice">
        <xs:complexContent>
            <xs:extension base="zc:TLice">
                <xs:sequence>
                    <xs:element name="naziv_poverenika">
                        <xs:simpleType>
                            <xs:restriction base="xs:string">
                                <xs:minLength value="1"/>
                                <xs:maxLength value="500"/>
                            </xs:restriction>
                        </xs:simpleType>
                    </xs:element>
                </xs:sequence>
            </xs:extension>
        </xs:complexContent>
    </xs:complexType>
    <xs:complexType name="TFizicko_lice">
        <xs:complexContent>
            <xs:extension base="zc:TLice">
                <xs:sequence>
                    <xs:element name="ime">
                        <xs:simpleType>
                            <xs:restriction base="xs:string">
                                <xs:minLength value="2"/>
                                <xs:maxLength value="15"/>
                            </xs:restriction>
                        </xs:simpleType>
                    </xs:element>
                    <xs:element name="prezime">
                        <xs:simpleType>
                            <xs:restriction base="xs:string">
                                <xs:minLength value="2"/>
                                <xs:maxLength value="20"/>
                            </xs:restriction>
                        </xs:simpleType>
                    </xs:element>
                    <xs:element name="drugi_podaci_za_kontakt">
                        <xs:simpleType>
                            <xs:restriction base="xs:string">
                                <xs:minLength value="1"/>
                                <xs:maxLength value="50"/>
                            </xs:restriction>
                        </xs:simpleType>
                    </xs:element>
                    <xs:element name="potpis">
                        <xs:simpleType>
                            <xs:restriction base="xs:string">
                                <xs:minLength value="1"/>
                            </xs:restriction>
                        </xs:simpleType>
                    </xs:element>
                </xs:sequence>
            </xs:extension>
        </xs:complexContent>
    </xs:complexType>
    <xs:complexType mixed="true" name="Ttelo_zalbe">
        <xs:sequence maxOccurs="unbounded">
            <xs:element name="zakon" maxOccurs="1" minOccurs="0" type="zc:TZakon"> </xs:element>
            <xs:element name="naziv_organa" minOccurs="0">
                <xs:simpleType>
                    <xs:restriction base="xs:string">
                        <xs:minLength value="1"/>
                        <xs:maxLength value="100"/>
                    </xs:restriction>
                </xs:simpleType>
            </xs:element>
            <xs:element name="razlozi" type="zc:Trazlozi" minOccurs="0"/>
            <xs:element name="datum" type="zc:TDatum" minOccurs="0"/>
            <xs:element name="podaci_o_zahtevu_i_informaciji" minOccurs="0">
                <xs:simpleType>
                    <xs:restriction base="xs:string">
                        <xs:minLength value="1"/>
                        <xs:maxLength value="1000"/>
                    </xs:restriction>
                </xs:simpleType>
            </xs:element>
            <xs:element name="napomena" minOccurs="0">
                <xs:simpleType>
                    <xs:restriction base="xs:string">
                        <xs:minLength value="1"/>
                    </xs:restriction>
                </xs:simpleType>
            </xs:element>
        </xs:sequence>
    </xs:complexType>
    <xs:complexType name="Tmesto_datum">
        <xs:sequence>
            <xs:element name="mesto">
                <xs:simpleType>
                    <xs:restriction base="xs:string">
                        <xs:minLength value="1"/>
                        <xs:maxLength value="20"/>
                    </xs:restriction>
                </xs:simpleType>
            </xs:element>
            <xs:element name="datum" type="zc:TDatum"/>
        </xs:sequence>
    </xs:complexType>
    <xs:complexType name="Trazlozi">
        <xs:sequence>
            <xs:element maxOccurs="3" minOccurs="3" name="razlog">
                <xs:complexType>
                    <xs:simpleContent>
                        <xs:extension base="xs:string">
                            <xs:attribute form="unqualified" name="podvuceno" type="xs:boolean"
                                use="required"/>
                            <xs:attribute form="unqualified" name="id" type="xs:int" use="required"
                            />
                        </xs:extension>
                    </xs:simpleContent>
                </xs:complexType>
            </xs:element>
        </xs:sequence>
    </xs:complexType>
    <xs:simpleType name="nivoi">
        <xs:annotation>
            <xs:documentation>Tip koji predstalvja nivoe 1-6</xs:documentation>
        </xs:annotation>
        <xs:restriction base="xs:positiveInteger">
            <xs:minInclusive value="1"/>
            <xs:maxInclusive value="6"/>
        </xs:restriction>
    </xs:simpleType>
    <xs:simpleType name="TDatum">
        <xs:restriction base="xs:string">
            <xs:pattern value="\d{2}[.]\d{2}[.]\d{4}[.]"/>
            <xs:length value="11"/>
        </xs:restriction>
    </xs:simpleType>
    <xs:complexType name="TZakon">
        <xs:sequence>
            <xs:element minOccurs="0" name="clan" type="zc:TClan"> </xs:element>
            <xs:element minOccurs="0" name="stav" type="zc:TStav"> </xs:element>
            <xs:element minOccurs="0" name="tacka" type="zc:TNaziv"> </xs:element>
            <xs:element minOccurs="1" name="naziv" type="zc:TNaziv"> </xs:element>
            <xs:element minOccurs="0" name="glasnik" type="zc:TGlasnik"> </xs:element>
        </xs:sequence>
    </xs:complexType>
    <xs:simpleType name="TStav">
        <xs:restriction base="xs:string">
            <xs:minLength value="1"/>
        </xs:restriction>
    </xs:simpleType>
    <xs:simpleType name="TClan">
        <xs:restriction base="xs:string">
            <xs:minLength value="1"/>
        </xs:restriction>
    </xs:simpleType>
    <xs:simpleType name="TTacka">
        <xs:restriction base="xs:string">
            <xs:minLength value="1"/>
        </xs:restriction>
    </xs:simpleType>
    <xs:simpleType name="TNaziv">
        <xs:restriction base="xs:string">
            <xs:minLength value="1"/>
        </xs:restriction>
    </xs:simpleType>
    <xs:simpleType name="TGlasnik">
        <xs:restriction base="xs:string">
            <xs:minLength value="1"/>
        </xs:restriction>
    </xs:simpleType>
</xs:schema>
