<?xml version="1.0" encoding="UTF-8"?>
<zc:zalba_cutanje 
 broj="000-00-0000-0000-00" 
 id="0" 
 nazivOrgana="nazivOrgana" 
 username="username"
 xmlns ="http://www.projekat.org/zalbazbogcutanja"
 xmlns:xsi="http://www.w3.org/2001/XMLSchema-instance" 
 xmlns:zc="http://www.projekat.org/zalbazbogcutanja"
 xmlns:pred="http://www.projekat.org/predicate/" 
 xsi:schemaLocation="http://www.projekat.org/zalbazbogcutanja zalbazbogcutanja.xsd ">
  <zc:broj xmlns:zc ="http://www.projekat.org/zalbazbogcutanja" property="pred:broj">000-00-0000-0000-00</zc:broj>
  <zc:naslov>zc:naslov</zc:naslov>
  <zc:podaci_o_povereniku>
    <zc:adresa>
      <zc:grad>zc:grad</zc:grad>
      <zc:ulica>zc:ulica</zc:ulica>
      <zc:broj>1</zc:broj>
    </zc:adresa>
    <zc:naziv_poverenika>zc:naziv_poverenika</zc:naziv_poverenika>
  </zc:podaci_o_povereniku>
  <zc:telo_zalbe>
    <zc:naziv_organa xmlns:zc ="http://www.projekat.org/zalbazbogcutanja" property="pred:organVlasti">zc:naziv_organa</zc:naziv_organa>
    <zc:razlozi>
      <zc:razlog id="0" podvuceno="true">zc:razlog</zc:razlog>
      <zc:razlog id="0" podvuceno="true">zc:razlog</zc:razlog>
      <zc:razlog id="0" podvuceno="true">zc:razlog</zc:razlog>
    </zc:razlozi>
    <zc:datum>10.10.2020.</zc:datum>
    <zc:podaci_o_zahtevu_i_informaciji>zc:podaci_o_zahtevu_i_informaciji</zc:podaci_o_zahtevu_i_informaciji>
  </zc:telo_zalbe>
  <zc:podaci_o_podnosiocu_zalbe>
    <zc:adresa>
      <zc:grad>zc:grad</zc:grad>
      <zc:ulica>zc:ulica</zc:ulica>
      <zc:broj>1</zc:broj>
    </zc:adresa>
    <zc:ime xmlns:zc ="http://www.projekat.org/zalbazbogcutanja" property="pred:ime">Imenic</zc:ime>
    <zc:prezime xmlns:zc ="http://www.projekat.org/zalbazbogcutanja" property="pred:prezime">Prezimic</zc:prezime>
    <zc:drugi_podaci_za_kontakt>zc:drugi_podaci_za_kontakt</zc:drugi_podaci_za_kontakt>
  </zc:podaci_o_podnosiocu_zalbe>
  <zc:podaci_o_mestu_i_datumu_podnosenja_zalbe>
    <zc:mesto xmlns:zc ="http://www.projekat.org/zalbazbogcutanja" property="pred:mesto">Mestasce</zc:mesto>
    <zc:datum xmlns:zc ="http://www.projekat.org/zalbazbogcutanja" property="pred:datum">10.11.2020.</zc:datum>
  </zc:podaci_o_mestu_i_datumu_podnosenja_zalbe>
</zc:zalba_cutanje>
