<?xml version="1.0" encoding="UTF-8"?>
<zalba_cutanje 
  xmlns="http://www.projekat.org/zalbazbogcutanja"
  xmlns:zc="http://www.projekat.org/zalbazbogcutanja"
  xmlns:xsi="http://www.w3.org/2001/XMLSchema-instance"
  xsi:schemaLocation="http://www.projekat.org/zalbazbogcutanja zalbazbogcutanja.xsd">
  <naslov zc:nivo="2" zc:stil="bold"> 
    ŽALBA KADA ORGAN VLASTI NIJE POSTUPIO/ nije 
    postupio u celosti/ PO ZAHTEVU TRAŽIOCA U ZAKONSKOM ROKU (ĆUTANjE UPRAVE)
  </naslov>
  <podaci_o_povereniku>
    <adresa>
      <grad></grad>
      <ulica></ulica>
      <broj></broj>
    </adresa>
    <naziv_poverenika>Povereniky za informacije od javnog značaja i zaštitu podataka o ličnosti</naziv_poverenika>
  </podaci_o_povereniku>
  <telo_zalbe>
    U skladu sa 
    <zakon>
      <clan>članom 22.</clan>
      <naziv>Zakona o slobodnom pristupu informacijama od javnog značaja</naziv>
    </zakon>
    podnosim:
    ZALBU protiv
    <naziv_organa>
    </naziv_organa>
    zbog toga sto organ vlasti nije:
    <razlozi>
      <razlog podvuceno="false" id="1">nije postupio</razlog>
      <razlog podvuceno="false" id="2">nije postupio u celosti</razlog>
      <razlog podvuceno="false" id="3">u zakonskom roku</razlog>
    </razlozi>
    po mom zahtevu za slobodan pristup informacijama od javnog značaja koji sam podneo tom organu 
    dana <datum></datum> godine, a kojim sam tražio/la da mi se u skladu sa 
    <zakon> 
      <naziv>Zakona o slobodnom pristupu informacijama od javnog značaja</naziv>
    </zakon>
    omogući uvid- kopija dokumenta koji sadrži informacije o /u vezi sa :
    <podaci_o_zahtevu_i_informaciji>
    </podaci_o_zahtevu_i_informaciji>
    Na osnovu iznetog, predlažem da Poverenik uvaži moju žalbu i 
    omogući mi pristup traženoj/im informaciji/ma.
    Kao dokaz , uz žalbu dostavljam kopiju zahteva sa dokazom o predaji organu vlasti
    <napomena>
      Kod žalbe zbog nepostupanju po zahtevu u celosti, treba priložiti i dobijeni odgovor organa vlasti.
    </napomena>
  </telo_zalbe>
  <podaci_o_podnosiocu_zalbe>
    <adresa>
      <grad></grad>
      <ulica></ulica>
      <broj></broj>
    </adresa>
    <ime></ime>
    <prezime></prezime>
    <drugi_podaci_za_kontakt></drugi_podaci_za_kontakt>
    <potpis></potpis>
  </podaci_o_podnosiocu_zalbe>
  <podaci_o_mestu_i_datumu_podnosenja_zalbe>
    <mesto></mesto>
    <datum></datum>
  </podaci_o_mestu_i_datumu_podnosenja_zalbe>
</zalba_cutanje>
