<?xml version="1.0" encoding="UTF-8"?>
<zc:zalba_cutanje 
  xmlns="http://www.projekat.org/zalbazbogcutanja"
  xmlns:zc="http://www.projekat.org/zalbazbogcutanja"
  xmlns:xsi="http://www.w3.org/2001/XMLSchema-instance"
  xmlns:pred="http://www.projekat.org/predicate/"
  about="http://www.projekat.org/zalbazbogcutanja/aa54057c188c-2021"
  xsi:schemaLocation="http://www.projekat.org/zalbazbogcutanja zalbazbogcutanja.xsd" 
  broj="aa54057c188c-2021"
  username="username"
  nazivOrgana="nazivOrgana">
  <zc:broj xmlns:zc="http://www.projekat.org/zalbazbogcutanja" property="pred:broj">aa54057c188c-2021</zc:broj>
  <zc:telo_zalbe> 
    <zc:naziv_organa xmlns:zc ="http://www.projekat.org/zalbazbogcutanja" property="pred:organVlasti">
      naziv organa
    </zc:naziv_organa>
    <zc:razlozi>
      <zc:razlog podvuceno="false" id="1">nije postupio</zc:razlog>
      <zc:razlog podvuceno="false" id="2">nije postupio u celosti</zc:razlog>
      <zc:razlog podvuceno="false" id="3">u zakonskom roku</zc:razlog>
    </zc:razlozi>
    <zc:datum>10.10.2010.</zc:datum> 
    <zc:podaci_o_zahtevu_i_informaciji>
      hasda hahda hsh adha adjhajda
    </zc:podaci_o_zahtevu_i_informaciji>
  </zc:telo_zalbe>
  <zc:podaci_o_podnosiocu_zalbe>
    <zc:adresa>
      <zc:grad>Grad2</zc:grad>
      <zc:ulica>Ulica2</zc:ulica>
      <zc:broj>10</zc:broj>
    </zc:adresa>
    <zc:ime xmlns:zc ="http://www.projekat.org/zalbazbogcutanja" property="pred:ime">Ime2</zc:ime>
    <zc:prezime xmlns:zc ="http://www.projekat.org/zalbazbogcutanja" property="pred:prezime">Prezime2</zc:prezime>
    <zc:drugi_podaci_za_kontakt>kjahdajbdkja</zc:drugi_podaci_za_kontakt>
    <zc:potpis>potpis2</zc:potpis>
  </zc:podaci_o_podnosiocu_zalbe>
  <zc:podaci_o_mestu_i_datumu_podnosenja_zalbe>
    <zc:mesto xmlns:zc ="http://www.projekat.org/zalbazbogcutanja" property="pred:mesto">Mesto1</zc:mesto>
    <zc:datum xmlns:zc ="http://www.projekat.org/zalbazbogcutanja" property="pred:datum">10.10.2010.</zc:datum>
  </zc:podaci_o_mestu_i_datumu_podnosenja_zalbe>
</zc:zalba_cutanje>